{
  "dispositions": [
    {
      "finding_id": "correctness-MAJ-1-r1",
      "disposition": "confirmed",
      "reason": "probe RED on internal/server/peek.go:42",
      "probe": "PROBE-R1-01",
      "evidence": "bin/acdsl check -rule PROBE-R1-01 -> exit 1: internal/server/peek.go:42"
    },
    {
      "finding_id": "code-style-NIT-1-r1",
      "disposition": "duplicate-of",
      "duplicate_of": "correctness-MAJ-1-r1"
    }
  ],
  "ranked_plan": [
    {
      "finding_id": "correctness-MAJ-1-r1",
      "file": "internal/server/peek.go",
      "line": 42,
      "severity": "MAJOR",
      "claim": "nil guard missing on the branch lookup",
      "fix": "guard the nil map before indexing",
      "artifact": "/tmp/artifacts/round-1/correctness-lane1.json",
      "artifact_id": "correctness-MAJ-1",
      "route": "auto-fix",
      "route_reason": "a mechanical nil guard, no judgment needed",
      "ignored": false,
      "known": false
    }
  ],
  "unverified": [],
  "funnel": {
    "produced": 2,
    "confirmed": 1,
    "unverified": 0,
    "duplicates": 1,
    "rejected": 0,
    "debunked": 0
  },
  "permanent_checks": [],
  "base_health": {
    "build": "ok",
    "tests": "ok"
  },
  "build_test": {
    "build": "ok",
    "tests": "ok"
  },
  "debunked": [],
  "resolved": [],
  "intentional_deviations": [],
  "coverage_gaps": [],
  "escalations": [],
  "definition_of_done": [
    {
      "criterion": "End-to-end verification",
      "status": "PASS",
      "notes": ""
    }
  ],
  "recommendation": "CONDITIONAL",
  "handoff_json": "/tmp/artifacts/round-1/review.json",
  "probes": [
    {
      "id": "PROBE-R1-01",
      "script": "probe-r1-01.sh",
      "fixture": "fixtures/probe-r1-01.go",
      "registry": "correctness-maj-1-r1.registry.json",
      "verdict": "RED on internal/server/peek.go:42",
      "finding_id": "correctness-MAJ-1-r1"
    }
  ],
  "probes_dir": "/tmp/artifacts/round-1/probes"
}
